{
  "$schema": "https://json-schema.org/draft/2020-12/schema",
  "$id": "https://sigilo-dev.github.io/A3/schemas/e0/entity.schema.json",
  "type": "object",
  "properties": {
    "schemaVersion": {
      "const": "1.0.0"
    },
    "id": {
      "$ref": "https://sigilo-dev.github.io/A3/schemas/e0/common.schema.json#/$defs/uuid"
    },
    "revision": {
      "$ref": "https://sigilo-dev.github.io/A3/schemas/e0/common.schema.json#/$defs/revision"
    },
    "type": {
      "$ref": "https://sigilo-dev.github.io/A3/schemas/e0/common.schema.json#/$defs/namespace"
    },
    "typeVersion": {
      "$ref": "https://sigilo-dev.github.io/A3/schemas/e0/common.schema.json#/$defs/version"
    },
    "title": {
      "type": "string",
      "minLength": 1
    },
    "contentResourceId": {
      "$ref": "https://sigilo-dev.github.io/A3/schemas/e0/common.schema.json#/$defs/uuid"
    },
    "tags": {
      "type": "array",
      "items": {
        "type": "string",
        "minLength": 1
      },
      "uniqueItems": true
    },
    "properties": {
      "$ref": "https://sigilo-dev.github.io/A3/schemas/e0/common.schema.json#/$defs/extensions"
    },
    "ports": {
      "type": "array",
      "items": {
        "type": "object",
        "properties": {
          "id": {
            "type": "string",
            "minLength": 1
          },
          "label": {
            "type": "string",
            "minLength": 1
          }
        },
        "required": [
          "id"
        ],
        "additionalProperties": true
      },
      "uniqueItems": true
    },
    "bindings": {
      "$ref": "https://sigilo-dev.github.io/A3/schemas/e0/common.schema.json#/$defs/extensions"
    },
    "extensions": {
      "$ref": "https://sigilo-dev.github.io/A3/schemas/e0/common.schema.json#/$defs/extensions"
    }
  },
  "required": [
    "schemaVersion",
    "id",
    "revision",
    "type",
    "typeVersion",
    "title",
    "tags",
    "properties",
    "ports",
    "bindings",
    "extensions"
  ],
  "additionalProperties": true
}
