{
  "schemaVersion": "1.0.0",
  "id": "00000000-0000-4000-8000-000000000002",
  "revision": 1,
  "type": "a3.core.page",
  "typeVersion": "1.0.0",
  "title": "Visión",
  "tags": [],
  "properties": {},
  "ports": [],
  "bindings": {},
  "extensions": {
    "demo.notes": {
      "unknownField": {
        "keep": true
      }
    }
  },
  "contentResourceId": "00000000-0000-4000-8000-000000000004"
}
